CATEGORY_1_NAME,CATEGORY_1_ID,CATEGORY_1_IMAGES,CATEGORY_2_NAME,CATEGORY_2_ID,CATEGORY_2_IMAGES,PRODUCT_TYPE,PRODUCT_ID,PARENT_ID,SKU,PRODUCT_NAME,PRODUCT_DESCRIPTION,ORIGINAL_PRICE,SELLING_PRICE,PRICE_RANGE,BRAND,VARIANT_COLOR,VARIANT_SIZE,VARIANT_PREPARATION,FULL_SIZE_IMAGES,PRODUCT_DETAILS,LOCATION_ID,ONHAND,TEMP_PRODIDS
ESPRESSO MACHINES,espressomachines,https://caas-demo-products.s3.amazonaws.com/b2c-accelerator/Coffeefy/1stincoffee+category+images/espresso_machines.png,SUPER AUTOMATICS,superautomatics,https://caas-demo-products.s3.amazonaws.com/b2c-accelerator/Coffeefy/1stincoffee+category+thumb+images/super+automatic+thumb.png,REGULAR,prod_id_15270,,sku_15270,Jura E8 Black V2,Innovative technologies in the JURA E line of super-automatic espresso machines are revolutionizing the enjoyment of coffee. The One-Touch Cappuccino function on the Jura E8 Black one-touch espresso machine creates trend specialties such as latte macchiato&#44; flat white and cappuccino at the touch of a button. The brewing process for ristretto and espresso has been 100% perfected. The Pulse Extraction Process (P.E.P.©) on the Jura E8 Black one-touch espresso machine is the only process of its kind in the world. It optimizes the extraction time and guarantees the very best aroma even for short specialty coffees.,2099,2099,$1000.00-$2499.99,Jura,,,,https://caas-demo-products.s3.amazonaws.com/b2c-accelerator/Coffeefy/1stincoffee_images/e8-black-angle.jpg|https://caas-demo-products.s3.amazonaws.com/b2c-accelerator/Coffeefy/1stincoffee_images/e8-black-front.jpg|https://caas-demo-products.s3.amazonaws.com/b2c-accelerator/Coffeefy/1stincoffee_images/e8-side.jpg| ,<br /><br />Key Features:<br />JURA’s E line of coffee and cappuccino makers is revolutionizing the enjoyment of coffee in every aspect. The espresso brewing process has been 100 % perfected. The Pulse Extraction Process (P.E.P.®) on the Jura E8 Black one-touch espresso machine is the only process of its kind in the world. It optimizes the extraction time and guarantees the very best aroma even for short specialty coffees.<br />CLEARYL Smart provides water of perfect quality for the best possible flavor. Filter usage has never been easier because the Intelligent Water System (I.W.S.) on the Jura E8 Black one-touch espresso machine automatically detects filter presence.<br />Buttons on the front of the Jura E8 Black and a modern TFT display make operation incredibly simple.<br /><br />Global innovation: P.E.P. for espresso of outstanding barista quality<br />The secret of exceptional coffee lies in the preparation. JURA has 100% perfected the espresso brewing process&#44; allowing the Jura E8 Black one-touch espresso machine to make specialty coffees to professional barista standard. The six-level AromaG3 grinder ensures that the coffee is optimally ground. It always grinds the beans fresh&#44; quickly yet gently to preserve the aroma. The variable brewing unit has a capacity of 5 to 16 grams and ensures optimum brewing conditions at all times. The Pulse Extraction Process (P.E.P.®) developed by JURA optimizes the extraction time. To make a short espresso&#44; it forces the hot water through the ground coffee at short intervals. This process allows the flavors of the coffee to fully develop. With eight different intensity levels&#44; coffee lovers can customize their coffee just the way they like it. For specialties such as cappuccino&#44; the innovative fine foam technology delivers fine milk foam that's as light as air. You'll love the result!<br /><br /><br /><br />Intelligent Water System for automatic filter detection<br />CLEARYL water filters supply perfect water quality to the coffee and cappuccino maker for the best possible flavor. They also protect the coffee machine against limescale and remove substances that could impair flavor and aroma (such as heavy metals or chlorine) from the water. To make maximum use of the filter and its capacity&#44; JURA developed the Intelligent Water System (I.W.S.®). The filter cartridge and coffee machine are wirelessly linked by RFID technology. The filter is detected automatically. Using the filter has never been easier or more reliable. <br /><br /><br /><br />JURA is setting new standards in very simple operation<br />For those who like to make their favorite coffee quickly&#44; the E8 coffee and cappuccino maker is ideal. The buttons for the espresso&#44; coffee&#44; cappuccino and milk foam functions are all positioned on the front for maximum convenience. The E8 can even prepare two espressi or coffees at the same time. Thanks to the modern TFT color display&#44; operating the machine is self-explanatory. The large bean container has a capacity of 10 ounces for uninterrupted coffee enjoyment. A special aroma preservation cover keeps the beans fresh. With a capacity of 64 ounces&#44; the water tank - which can be conveniently accessed from the front - also lasts a long time without refilling. Clear&#44; symmetrical forms&#44; harmonious lines and a love of detail give the E8 an elegant aesthetic that looks stunning in any kitchen. Its elegant design will continue to impress for years to come.<br /><br /><br /><br />Total hygiene<br />Maintaining the modern automatic coffee machine is just as simple as preparing tempting specialty coffees. The integrated rinsing and cleaning programs can be started at the touch of a button to keep the Jura E8 Black one-touch espresso machine impeccably hygienic. Now the dishwasher-safe milk spout can be replaced in a flash. Total hygiene and the perfect milk foam are guaranteed at all times from this coffee and cappuccino maker.<br /><br /><br /><br />,wh2-boston,1000,
ESPRESSO MACHINES,espressomachines,https://caas-demo-products.s3.amazonaws.com/b2c-accelerator/Coffeefy/1stincoffee+category+images/espresso_machines.png,SUPER AUTOMATICS,superautomatics,https://caas-demo-products.s3.amazonaws.com/b2c-accelerator/Coffeefy/1stincoffee+category+thumb+images/super+automatic+thumb.png,REGULAR,prod_id_15216,,sku_15216,Jura D6 Platinum,Simple and powerful defines the Jura D6 automatic coffee center. The rotary switch and text display simplify the brewing process: With the touch of a button&#44; the Jura D6 allows you to brew a perfect cup of coffee. The fine foam technology adds light milk foam to top off a cup of cappuccino&#44; giving you professional quality specialty coffee at home using this Jura coffee machine.,999,999,$500.00-$999.99,Jura,,,,https://caas-demo-products.s3.amazonaws.com/b2c-accelerator/Coffeefy/1stincoffee_images/jura-d6.jpg|https://caas-demo-products.s3.amazonaws.com/b2c-accelerator/Coffeefy/1stincoffee_images/d6_3.jpg|https://caas-demo-products.s3.amazonaws.com/b2c-accelerator/Coffeefy/1stincoffee_images/d6_4.jpg|https://caas-demo-products.s3.amazonaws.com/b2c-accelerator/Coffeefy/1stincoffee_images/d6_8.jpg|https://caas-demo-products.s3.amazonaws.com/b2c-accelerator/Coffeefy/1stincoffee_images/d6_6.jpg,<br /><br />Key Features of the Jura D6 automatic coffee center:<br />Pulse Extraction Process (P.E.P.®) ensures the optimum extraction time for espresso. <br />A stainless steel thermoblock heating system offers two brewing temperatures.<br />A high pressure pump produces great flavor and crema and the fine foam technology adds a flavorful milk foam finish.<br />The Clearyl Smart filter cartridge removes impurities from the water to improve flavor. <br />Blue-tooth compatible with optional Smart Connect.<br /><br />Ease of Operation<br />The Jura D6 automatic coffee center operates with the flip of a switch. Use the rotary switch and 11-language plain text display to select the specialty coffee you want&#44; push the button and watch the machine whirl to life creating the perfect brew. The Jura D6 coffee machine was designed to be simple to maintain&#44; too. With the addition of the Jura Blue-tooth Smart Connect device&#44; the D6 functionality can be expanded using the Jura App&#44; J.O.E.<br /><br /><br /><br />Reach New Heights<br />A height-adjustable coffee spout can be moved between 2.6 and 4.4 inches to accommodate cups in a range of sizes. You may use the Jura D6 coffee maker to brew espresso in a small cup or latte macchiato in a tall glass. The bonus: A height-adjustable spout on the D6 prevents splashing and produces an amazing velvet crema.<br /><br /><br /><br />Fine Foam<br />Jura pioneered fine foam technology to create milk foam with a feather-light consistency. With the Jura espresso machine&#44; all it takes is the push of a button to top your favorite specialty coffee with professional quality milk foam. <br /><br /><br /><br />Efficient Elegance<br />A combination of sleek lines&#44; premium materials and uncompromising workmanship are part of all Jura espresso machines and this one is no exception. The Jura D6 automatic coffee center is compact enough to fit in a small space&#44; and the matte and gloss surfaces ensure it’s still big on style.<br /><br /><br /><br />,wh2-boston,1000,
ESPRESSO MACHINES,espressomachines,https://caas-demo-products.s3.amazonaws.com/b2c-accelerator/Coffeefy/1stincoffee+category+images/espresso_machines.png,SUPER AUTOMATICS,superautomatics,https://caas-demo-products.s3.amazonaws.com/b2c-accelerator/Coffeefy/1stincoffee+category+thumb+images/super+automatic+thumb.png,REGULAR,prod_id_15192,,sku_15192,Jura Z8,Jura achieved another first: The Jura Z8 is the first automatic coffee machine to offer a once-touch Americano function. The special preparation method simultaneously combines coffee with hot water during preparation for a full-bodied&#44; flavorful brew at the touch of a button. Not in the mood for an Americano? The Z8 prepares 21 other specialty coffee beverages; double heating systems and pumps allow simultaneous preparation of coffee and milk to ensure you never have to wait for your caffé latte. The Jura Z8 is also Bluetooth compatible providing advanced control through the Jura App&#44; J.O.E.,4399,4399,$2500.00-$4999.99,Jura,,,,https://caas-demo-products.s3.amazonaws.com/b2c-accelerator/Coffeefy/1stincoffee_images/z8-6.jpg|https://caas-demo-products.s3.amazonaws.com/b2c-accelerator/Coffeefy/1stincoffee_images/z8_emo_al_lungoprep_en_office_eng_16682.jpg|https://caas-demo-products.s3.amazonaws.com/b2c-accelerator/Coffeefy/1stincoffee_images/z8_emo_al_screen_2esp_en_office_eng_16680.jpg|https://caas-demo-products.s3.amazonaws.com/b2c-accelerator/Coffeefy/1stincoffee_images/z8-beverage_guide.jpg|https://caas-demo-products.s3.amazonaws.com/b2c-accelerator/Coffeefy/1stincoffee_images/z8-4.jpg,"<br /><br />Key Features:<br />The Jura Z8 automatic coffee machine revolutionizes the brewing process. From ristretto to flat white&#44; this high-tech counter top espresso machine sets the standard for specialty coffee brewing. Impressive Swiss innovation perfects the brewing process&#44; allowing the Jura Z8 to achieve the same standards as the best coffee bars in the world.<br />The Jura Z8 coffee machine features:<br />The new Pulse Extraction Process (PEP) that optimizes extraction time by pressing water through the ground coffee in short bursts.<br />Aroma G3 grinder preserves the aroma while grinding to the optimal fineness<br />Fine Foam Technology - creates finely textured&#44; long lasting milk foam for cappuccino and latte<br />The selection of 21 different specialties takes place intuitively&#44; thanks to self-explanatory graphics on a high-resolution 4.3"" touchscreen color display.<br />Bluetooth compatible providing advanced control through the Jura App&#44; J.O.E.<br />A state-of-the-art Clearyl Smart water filtration system that removes impurities like chlorine and calcium<br /><br /><br />State of the Art Brewing<br />Jura has a reputation for pushing the envelope and designing state-of-the-art machines that make it simple to be your own barista and the Z8 is no exception. In addition to the one-touch Americano function&#44; the Z8 brews 21 different coffees&#44; including espresso&#44; ristretto&#44; macchiato&#44; cappuccino and flat white (and offers 16 programmable beverage options); it also dispenses hot water&#44; milk and milk foam.<br />The Z8 boasts another high-tech tool. It’s Bluetooth compatible and equipped with Smart Connect&#44; which allows you to connect to the Z8 wirelessly via a smartphone or tablet through the JOE (Jura Operating Experience) app. Making a great cup of specialty coffee has never been easier.<br /><br /><br /><br />Better Coffee&#44; Faster<br />The Jura Z8 automatic coffee machine doesn’t just brew great coffee; it brews great coffee&#44; fast. Program the machine to remember your favorite brews at the touch of a button; let two ThermoBlock heating systems prepare coffee and milk at the same time; embrace automatic switchover from milk to milk foam; and use the large color touchscreen to make it all happen. The AromaG3 grinder is twice as fast (and makes half as much noise) as conventional grinders.<br /><br /><br /><br />Fantastic Features<br />All Jura machines were designed with impressive Swiss innovation and the Z8 incorporates some of the most popular features.<br />The Pulse Extraction Process presses water through the ground coffee in short bursts to optimize extraction time; the Intelligent Pre-Brew Aroma System dispenses heated water over ground coffee to release the flavors; and a CLEARYL smart filer removes impurities from tap water to maximize flavor. The Z8 also has a variable brewing chamber to accommodate up to 16 grams of ground coffee and an active bean monitoring system to warn you when beans are low.<br /><br /><br /><br />Focus on Foam<br />The Z8 switches from milk to milk foam automatically so you never have to think about the settings. It also offers the popular Jura fine foam technology that produces fine&#44; feather-light milk foam to add the finishing touch to a cup of specialty coffee. The pre-programmed settings mean that your Z8 always knows that coffee&#44; hot milk and milk foam must be added in a precise order to make the perfect cup of coffee. All you have to do is press a button and wait for the perfect cup of specialty coffee to brew.<br /><br /><br /><br />A Dream to Clean<br />Thanks to an exclusive two-compartment cleaning container included with the Jura Z8&#44; cleaning the milk system easier than ever.<br /><br /><br /><br />",wh2-boston,1000,
ESPRESSO MACHINES,espressomachines,https://caas-demo-products.s3.amazonaws.com/b2c-accelerator/Coffeefy/1stincoffee+category+images/espresso_machines.png,SUPER AUTOMATICS,superautomatics,https://caas-demo-products.s3.amazonaws.com/b2c-accelerator/Coffeefy/1stincoffee+category+thumb+images/super+automatic+thumb.png,REGULAR,prod_id_15212,,sku_15212,Jura S8 Chrome,With its clean lines&#44; the stylish Jura S8 espresso coffee machine exudes quality and precision in every way. This touch screen coffee maker combines the best of all the quality&#44; features&#44; and innovations Jura is known for. The impressive range of specialty coffee drinks and the stunning result in the cup satisfy even the most demanding coffee connoisseurs. The color touch-screen display is based on simplicity and intelligence.,2999,2999,$2500.00-$4999.99,Jura,,,,https://caas-demo-products.s3.amazonaws.com/b2c-accelerator/Coffeefy/1stincoffee_images/s8-chrome2_1.jpg|https://caas-demo-products.s3.amazonaws.com/b2c-accelerator/Coffeefy/1stincoffee_images/s8-chrome.jpg|https://caas-demo-products.s3.amazonaws.com/b2c-accelerator/Coffeefy/1stincoffee_images/s8_2.jpg| ,<br /><br />Key Features:<br />The Jura S8 coffee machine's Aroma G3 grinder can grind fresh coffee beans twice as fast as conventional grinders without sacrificing aroma or flavor.<br />Integrated high-resolution color display on the touch screen coffee maker means it's easier than ever to brew the perfect cup of specialty coffee.<br />Options to choose the size&#44; strength and temperature of your favorite drinks—and pre-program them for one-touch brewing.<br />A professional fine foam frother to make barista quality foam at home.<br />A new Pulse Extraction Process (PEP) that optimizes extraction time by pressing water through the ground coffee in short bursts.<br /><br />Multifaceted Machine<br />The Jura S8 espresso coffee machine is part of an award-winning new line of JURA touch screen coffee makers. More than a coffee machine&#44; the Jura S8 allows you to brew a full range of specialty coffees from espresso to latte macchiato. The new model offers all of the iconic JURA technologies with impressive upgrades: The Aroma G3 grinder more precise and faster than ever without compromising the delicious aroma of the coffee beans; the full color touchscreen brews 15 different specialties at the touch of a button; and the patented Pulse Extraction Process (PEP) ensures the optimum extraction time for shorter brews&#44; delivering an unprecedented taste explosion for espresso and ristretto.<br /><br /><br /><br />One Touch Technology<br />JURA is known for its one-touch technology and the S8 espresso coffee machine is no exception. The simple&#44; modern design makes the touch screen coffee maker incredibly simple to operate: Simply select your specialty coffee from the high-resolution color touchscreen display menu and watch the magic happen. While your specialty coffee brews&#44; graphics on the 4.3-inch screen illustrate every step of preparation.  You can program your preferences&#44; making it effortless to brew the perfect espresso&#44; latte macchiato or ristretto. <br /><br /><br /><br />Foam-tastic<br />Characteristic JURA design reflects precision and quality down to the smallest detail. The S8 features a professional fine foam frother made from the highest quality materials. Designed for the preparation of specialty coffees with milk and milk foam&#44; the frother makes latte macchiato and other beverages with the very best fine-textured foam—and operating it is as simple as selecting the foam option from the touchscreen menu. <br /><br /><br /><br />Refined Design<br />You’ll fall in love at first sight. The S8 espresso coffee machine features an elegant design with clean lines and a sleek design. From the silver finish to a bean container made of hand-polished die-cast zinc&#44; no detail has been spared to give this compact machine a major presence. Several design features also make the JURA S8 simple to operate. Smart monitors indicate when it’s time to add water&#44; fill beans&#44; replace the water filter and empty the drip tray. The S8 also offers an automatic cleaning function. You can sit back and sip your favorite brew while this impressive machine handles the dirty work. <br /><br /><br /><br />,wh2-boston,1000,
ESPRESSO MACHINES,espressomachines,https://caas-demo-products.s3.amazonaws.com/b2c-accelerator/Coffeefy/1stincoffee+category+images/espresso_machines.png,SUPER AUTOMATICS,superautomatics,https://caas-demo-products.s3.amazonaws.com/b2c-accelerator/Coffeefy/1stincoffee+category+thumb+images/super+automatic+thumb.png,REGULAR,prod_id_15210,,sku_15210,Jura S8 Silver,With its clean lines&#44; the stylish Jura Capresso S8 exudes quality and precision in every way. This touch screen coffee machine combines the best of all the quality&#44; features and innovations Jura is known for. The impressive range of specialty coffee drinks and the stunning result in the cup satisfy even the most demanding coffee connoisseurs. The color touch-screen display is based on simplicity and intelligence.,2899,2899,$2500.00-$4999.99,Jura,,,,https://caas-demo-products.s3.amazonaws.com/b2c-accelerator/Coffeefy/1stincoffee_images/s8-left.jpg|https://caas-demo-products.s3.amazonaws.com/b2c-accelerator/Coffeefy/1stincoffee_images/s8-straight.jpg|https://caas-demo-products.s3.amazonaws.com/b2c-accelerator/Coffeefy/1stincoffee_images/s8-right.jpg| ,<br /><br />Key Features:<br />Jura S8's Aroma G3 grinder can grind fresh coffee beans twice as fast as conventional grinders without sacrificing aroma or flavor.<br />Integrated high-resolution color display on the touch screen coffee machine makes it easier than ever to brew the perfect cup of specialty coffee.<br />Options to choose the size&#44; strength and temperature of your favorite drinks—and pre-program them for one-touch brewing.<br />A professional fine foam frother to make barista quality foam at home.<br />A new Pulse Extraction Process (PEP) that optimizes extraction time by pressing water through the ground coffee in short bursts.<br /><br />Multifaceted Machine<br />The Jura S8 is part of an award-winning new line of JURA touch screen coffee machines. More than a coffee machine&#44; the S8 allows you to brew a full range of specialty coffees from espresso to latte macchiato. The new model offers all of the iconic JURA technologies with impressive upgrades: The Aroma G3 grinder more precise and faster than ever without compromising the delicious aroma of the coffee beans; the full color touchscreen brews 15 different specialties at the touch of a button; and the patented Pulse Extraction Process (PEP) ensures the optimum extraction time for shorter brews&#44; delivering an unprecedented taste explosion for espresso and ristretto.<br /><br /><br /><br />One Touch Technology<br />JURA is known for its one-touch technology and the S8 is no exception. The simple&#44; modern design makes the machine incredibly simple to operate: Simply select your specialty coffee from the high-resolution color touchscreen display menu and watch the magic happen. While your specialty coffee brews&#44; graphics on the 4.3-inch screen illustrate every step of preparation.  You can program your preferences&#44; making it effortless to brew the perfect espresso&#44; latte macchiato or ristretto. <br /><br /><br /><br />Foam-tastic<br />Characteristic JURA design reflects precision and quality down to the smallest detail. The S8 features a professional fine foam frother made from the highest quality materials. Designed for the preparation of specialty coffees with milk and milk foam&#44; the frother makes latte macchiato and other beverages with the very best fine-textured foam—and operating it is as simple as selecting the foam option from the touchscreen menu. <br /><br /><br /><br />Refined Design<br />You’ll fall in love at first sight. The S8 features an elegant design with clean lines and a sleek design. From the silver finish to a bean container made of hand-polished die-cast zinc&#44; no detail has been spared to give this compact machine a major presence. Several design features also make the JURA S8 simple to operate. Smart monitors indicate when it’s time to add water&#44; fill beans&#44; replace the water filter and empty the drip tray. The S8 also offers an automatic cleaning function. You can sit back and sip your favorite brew while this impressive machine handles the dirty work. <br /><br /><br /><br />,wh2-boston,1000,
