CATEGORY_1_NAME,CATEGORY_1_ID,CATEGORY_1_IMAGES,CATEGORY_2_NAME,CATEGORY_2_ID,CATEGORY_2_IMAGES,PRODUCT_TYPE,PRODUCT_ID,PARENT_ID,SKU,PRODUCT_NAME,PRODUCT_DESCRIPTION,ORIGINAL_PRICE,SELLING_PRICE,PRICE_RANGE,BRAND,VARIANT_COLOR,VARIANT_SIZE,VARIANT_PREPARATION,FULL_SIZE_IMAGES,PRODUCT_DETAILS,LOCATION_ID,ONHAND,TEMP_PRODIDS
COFFEE,coffee,https://caas-demo-products.s3.amazonaws.com/b2c-accelerator/Coffeefy/1stincoffee+category+images/coffee.png,GROUND ESPRESSO,groundespresso,https://caas-demo-products.s3.amazonaws.com/b2c-accelerator/Coffeefy/1stincoffee+category+images/espresso+grinders.png,REGULAR,prod_id_493,,sku_493,Illy Fine Grind Medium Roast Decaf Case of 6,Fine Grind&#44; illy decaf espresso coffee&#44; perhaps the perfect espresso blend. 100% Arabica coffee. Six 8.8 oz. cans of decaffeinated espresso per case.,90,90,$50.00-$99.99,Illy,,,,https://caas-demo-products.s3.amazonaws.com/b2c-accelerator/Coffeefy/1stincoffee_images/illy-decaf-493.jpg| ,"<br /><br />More About illy Decaffeinated<br />For many&#44; coffee without caffeine is a pointless exercise. Caffeine&#44; which acts on the prefrontal cortex&#44; increases alertness and improves short-term memory. Each person has their own threshold for caffeine—the point where it ceases to be pleasant and gives us the jitters. People who enjoy coffee in the morning may eschew it in the evening. And there are others who enjoy a cup of coffee&#44; hold the caffeine please.<br />""In creating our decaffeinated illy coffee&#44; we wanted to keep the complex aromas that illy is known for&#44;"" says Dr. Ernesto Illy. ""After careful research&#44; we selected our decaffeinating process based on its superior conservation of aromas and full&#44; pleasant taste in the decaf. In blind tastings&#44; many professional tasters picked illy decaf as their first choice for aroma and taste—even beating our regular (caffeinated) coffee. That is because inherently caffeine has a slight bitterness to it&#44; so when you decaffeinate coffee properly&#44; it tastes slightly sweeter. If you can also capture the same complex aromas—you have a truly wonderful cup of coffee—if you don't miss the caffeine.""<br />A Short History of Decaffeination<br />Dr. Ludwig Roselius and Dr. Karl Wimmer invented the process of removing caffeine from coffee in Bremen&#44; Germany as described in a patent letter dated from 1905. By 1912 the first decaffeinating plant was opened in the United States.<br />In order for a coffee to be designated as ""decaffeinated"" the caffeine content must be lower than 0.10% according to the European Standard<br />There are several methods of making decaffeinated espresso and coffee: Methylene Chloride&#44; Ethyl Acetate&#44; and Water Process<br />illycaffè's method of choice - Carbon Dioxide<br />This process is technically known as supercritical fluid extraction. In the carbon dioxide method&#44; the caffeine is stripped directly from the beans by a highly compressed semi-liquid form of carbon dioxide. Pre-steamed beans are soaked in a bath of supercritical carbon dioxide at a pressure of 73 to 300 atmospheres. After a thorough soaking for around ten hours&#44; the pressure is reduced&#44; allowing the CO2 to evaporate&#44; or the pressurized CO2 is run through either water or charcoal filters to remove the caffeine. The carbon dioxide is then used on another batch of beans. This liquid works better than water because it is kept in supercritical state near the transition from liquid to gas&#44; combining favorable diffusivity properties of the gas with increased density of a liquid. This process has the advantage that it avoids the use of potentially harmful substances.<br />The extracted caffeine is purified and sold to pharmaceutical firms&#44; soft drink companies and other businesses that add caffeine to their products.<br />The USFDA (United States Food and Drug Administration) allows a residual Methylene chloride content of 10 parts per million. However&#44; after roasting not even these trace levels are detectable in the bean. The Methylene chloride dissipates at a much lower temperature (approx 120° Fahrenheit) than the coffee is roasted at (approx.428° Fahrenheit).<br />Other decaffeinating methods include methylene chloride&#44; ethyl acetate and water process. Illycaffè does not use the water process because water processed coffees generally produce a less flavorful and flatter bodied cup of coffee. This process uses warm water under pressure to extract caffeine. The water is heated&#44; 70-100° Celsius (120 to 160° Fahrenheit) and circulated until 94% to 96% of the caffeine is removed. In some cases the water is put through carbon filtration to remove the caffeine. Since caffeine is not the only substance in coffee that is soluble&#44; important flavor components are also affected.<br />Coffee and caffeine have been the subject of extensive scientific research in the last 25 years. Some 1500 to 2000 papers per year have been published and we can assume that there are few products that we consume that have been so thoroughly and deeply studied. New research has shown that caffeine has many positive effects on the body—from improving concentration to fighting depression and reducing the risk of gallstones. But for the country's 107 million coffee drinkers&#44; coffee is a pleasure&#44; not a medicine&#44; and for those who want a break from caffeine&#44; illy provides the best tasting decaf available. Enjoy illy decaf espresso coffee from 1st in Coffee.<br />",wh2-boston,1000,
COFFEE,coffee,https://caas-demo-products.s3.amazonaws.com/b2c-accelerator/Coffeefy/1stincoffee+category+images/coffee.png,GROUND ESPRESSO,groundespresso,https://caas-demo-products.s3.amazonaws.com/b2c-accelerator/Coffeefy/1stincoffee+category+images/espresso+grinders.png,REGULAR,prod_id_8866,,sku_8866,Illy Moka for Stove Top Case of 6,illy Ground for Stove Top. This illy Moka Medium Roast coffee&#44; is a classic blend of coffee from around the world. 100% Arabica coffee. Six 8.8 oz. cans of illy Moka ground coffee per case.,84,84,$50.00-$99.99,Illy,,,,https://caas-demo-products.s3.amazonaws.com/b2c-accelerator/Coffeefy/1stincoffee_images/illy-moka.jpg| ,<br /><br />illy Ground for Stove Top. This illy Moka Medium Roast coffee&#44; is a classic blend of coffee from around the world. 100% Arabica coffee. Six 8.8 oz. cans per case.<br />,wh2-boston,1000,
COFFEE,coffee,https://caas-demo-products.s3.amazonaws.com/b2c-accelerator/Coffeefy/1stincoffee+category+images/coffee.png,GROUND ESPRESSO,groundespresso,https://caas-demo-products.s3.amazonaws.com/b2c-accelerator/Coffeefy/1stincoffee+category+images/espresso+grinders.png,REGULAR,prod_id_792892,,sku_792892,Kimbo Espresso Antica Tradizione 8 8 oz Brick,A medium dark roast of quality coffee with the exquisite traditional Neapolitan taste renowned the world over. Intense and persistent&#44; the Kimbo blend has been a favorite in Naples for 50 years.,8,8,$0.00-$9.99,Kimbo,,,,https://caas-demo-products.s3.amazonaws.com/b2c-accelerator/Coffeefy/1stincoffee_images/kimbo-white-brick.jpg| ,<br /><br />A medium dark roast of quality coffee with the exquisite traditional Neapolitan taste renowned the world over. The original Kimbo blend from Napoli&#44; Italy.Vacuum packed 8.8 oz. brick of Kimbo dark roast espresso coffee.<br />,wh2-boston,1000,
COFFEE,coffee,https://caas-demo-products.s3.amazonaws.com/b2c-accelerator/Coffeefy/1stincoffee+category+images/coffee.png,GROUND ESPRESSO,groundespresso,https://caas-demo-products.s3.amazonaws.com/b2c-accelerator/Coffeefy/1stincoffee+category+images/espresso+grinders.png,REGULAR,prod_id_602047,,sku_602047,Kimbo Aroma Gold 8 8 oz can,A very nice blend of exceptional 100% Arabica Coffee from Central and South America. Delicate and Smooth. Kimbo Aroma Gold Espresso is sold in 8.8 oz. cans.,8.49,8.49,$0.00-$9.99,Kimbo,,,,https://caas-demo-products.s3.amazonaws.com/b2c-accelerator/Coffeefy/1stincoffee_images/kimbo_aroma_gold.jpg| ,<br /><br />A blend of the prestigious coffees and a special roasting process give Kimbo Aroma Gold coffee its perfect taste and rich aroma. Medium grind for stove top espresso or drip coffee makers.<br />,wh2-boston,1000,
COFFEE,coffee,https://caas-demo-products.s3.amazonaws.com/b2c-accelerator/Coffeefy/1stincoffee+category+images/coffee.png,GROUND ESPRESSO,groundespresso,https://caas-demo-products.s3.amazonaws.com/b2c-accelerator/Coffeefy/1stincoffee+category+images/espresso+grinders.png,REGULAR,prod_id_602074,,sku_602074,Kimbo White Coffee 8 8 oz can,A blend of the finest Brazilian coffees roasted in the Neapolitan tradition to give the distinct full bodied taste. Medium grind for stove top espresso or drip coffee makers.,7.99,6.99,$0.00-$9.99,Kimbo,,,,https://caas-demo-products.s3.amazonaws.com/b2c-accelerator/Coffeefy/1stincoffee_images/kimbo-white-can_1_2.jpg| ,<br /><br />A blend of the finest Brazilian coffees roasted in the Neapolitan tradition to give the distinct full bodied taste. Medium grind for stove top espresso or drip coffee makers.<br />The original Kimbo blend is a 50 year old tradition from Naples&#44; Italy.<br />,wh2-boston,1000,
COFFEE,coffee,https://caas-demo-products.s3.amazonaws.com/b2c-accelerator/Coffeefy/1stincoffee+category+images/coffee.png,GROUND ESPRESSO,groundespresso,https://caas-demo-products.s3.amazonaws.com/b2c-accelerator/Coffeefy/1stincoffee+category+images/espresso+grinders.png,REGULAR,prod_id_lav004,,sku_lav004,Lavazza Caffe Espresso 8 oz Can,100% Arabica blend of the highest quality beans&#44; which have been carefully selected and evenly roasted to produce a coffee with a smooth flavor and a tempting aroma.,8.5,8.5,$0.00-$9.99,Lavazza,,,,https://caas-demo-products.s3.amazonaws.com/b2c-accelerator/Coffeefy/1stincoffee_images/lavazza-ground-espresso.jpg| ,<br /><br />Lavazza. Italy's leading coffee company&#44; has been roasting coffees for over 100 years at its plant in the northwest Italian city of Turin.  Lavazza's state-of-the-art roasting facility boasts the world's highest concentration of advanced coffee technology.  The entire process&#44; from sacks of green beans to pallets of packaged roasted coffees&#44; is computerized and centrally monitored.  Special attention is paid to each bean as it is inspected for any imperfections and then roasted in air convection roasters which guarantee that each bean is evenly browned and never scorched.  Lavazza's investments in technology&#44; research and development and its dedication to quality control combined with the long roasting tradition of this family-owned company have made the Lavazza brand recognizable worldwide as the leader in espresso coffee.<br />Over one hundred years ago&#44; Luigi Lavazza created the concept of blends&#44; an aspect that has discovered its maximum expression in the culture of coffee. A fundamental part of making a quality beverage&#44; the finest blends come from a mixture of different coffee varieties - up to even five or six. For example&#44; blends made exclusively with Arabica are sweeter and more fragrant&#44; while blends of Arabica and Robusta have a more full-bodied and decisive flavor. With over one hundred years of experience&#44; today Lavazza modulates the sensory characteristics in the cup with 100% Arabica blends as well as blends with both Arabica and Robusta. Lavazza espresso coffee uses various coffees from Brazil and Central American&#44; this allows us to create a wide range of blends with different notes of flavor and aroma: a full&#44; chocolaty flavor when the Brazilian qualities prevail&#44; or fragrant&#44; delicate&#44; mildly acidic and aromatic coffee when we use washed Arabica from Central America<br />,wh2-boston,1000,
COFFEE,coffee,https://caas-demo-products.s3.amazonaws.com/b2c-accelerator/Coffeefy/1stincoffee+category+images/coffee.png,GROUND ESPRESSO,groundespresso,https://caas-demo-products.s3.amazonaws.com/b2c-accelerator/Coffeefy/1stincoffee+category+images/espresso+grinders.png,REGULAR,prod_id_lav005,,sku_lav005,Lavazza Decaf Espresso 8 oz can,This Lavazza decaf coffee is a 100% Arabica blend of top quality washed coffee varieties from Central America and natural Arabica beans from Brazil. The caffeine has been removed by the gentle water-process method&#44; which maintains the coffee’s full&#44; rich flavor. 8 oz coffee tin.,10,10,$10.00-$24.99,Lavazza,,,,https://caas-demo-products.s3.amazonaws.com/b2c-accelerator/Coffeefy/1stincoffee_images/lavazza-decaf.jpg| ,<br /><br />Top quality washed&#44; 100% Arabica blend coffee&#44; featuring varieties from Central America and natural Arabica beans from Brazil.<br />,wh2-boston,1000,
COFFEE,coffee,https://caas-demo-products.s3.amazonaws.com/b2c-accelerator/Coffeefy/1stincoffee+category+images/coffee.png,GROUND ESPRESSO,groundespresso,https://caas-demo-products.s3.amazonaws.com/b2c-accelerator/Coffeefy/1stincoffee+category+images/espresso+grinders.png,REGULAR,prod_id_lav008,,sku_lav008,Lavazza Crema E Gusto 8 8 oz Bricks,Imported from Italy&#44; Crema E Gusto is a dark blend of full-bodied density&#44; ideal as the base for specialty coffees; Cappuccino&#44; Latte&#44; Iced coffee&#44; etc. This Lavazza Crema E Gusto ground espresso brick blend has a strong&#44; well balanced aroma with a rich aftertaste and chocolaty notes and zero bitterness. It will produce a savory espresso with thick crema.,6.75,5.99,$0.00-$9.99,Lavazza,,,,https://caas-demo-products.s3.amazonaws.com/b2c-accelerator/Coffeefy/1stincoffee_images/cremaegusto.jpg| ,<br /><br />Imported from Italy&#44; Crema E Gusto is a dark blend of full-bodied density&#44; ideal as the base for specialty coffees; Cappuccino&#44; Latte&#44; Iced coffee&#44; etc.<br />,wh2-boston,1000,
COFFEE,coffee,https://caas-demo-products.s3.amazonaws.com/b2c-accelerator/Coffeefy/1stincoffee+category+images/coffee.png,GROUND ESPRESSO,groundespresso,https://caas-demo-products.s3.amazonaws.com/b2c-accelerator/Coffeefy/1stincoffee+category+images/espresso+grinders.png,REGULAR,prod_id_lav007,,sku_lav007,Lavazza Qualita Rossa 8 8 oz Bricks,Lavazza Qualita Rossa is a combination of the finest Arabica and Robusta coffees. This is a full-bodied&#44; richly flavored blend that will produce an outstanding cup of coffee. Offers a perfect balance of flavor&#44; body and aroma that will keep you coming back for more. Ground coffee imported from Italy.,6.49,6.49,$0.00-$9.99,Lavazza,,,,https://caas-demo-products.s3.amazonaws.com/b2c-accelerator/Coffeefy/1stincoffee_images/lavazza-qualita-rossa-brick.jpg|https://caas-demo-products.s3.amazonaws.com/b2c-accelerator/Coffeefy/1stincoffee_images/lavazza-qualita-rossa-brick_1.jpg| ,<br /><br />Lavazza Qualita Rossa is a combination of the finest Arabica and Robusta coffees. .<br />,wh2-boston,1000,
COFFEE,coffee,https://caas-demo-products.s3.amazonaws.com/b2c-accelerator/Coffeefy/1stincoffee+category+images/coffee.png,GROUND ESPRESSO,groundespresso,https://caas-demo-products.s3.amazonaws.com/b2c-accelerator/Coffeefy/1stincoffee+category+images/espresso+grinders.png,REGULAR,prod_id_lav002,,sku_lav002,Lavazza Qualita Oro 8 8 oz can,Lavazza Qualita Oro is an 100% Arabica coffee blend of Central American and African coffee beans. Noted for its full body flavor&#44; it also offers hint of floral flavors as well.,8.99,8.99,$0.00-$9.99,Lavazza,,,,https://caas-demo-products.s3.amazonaws.com/b2c-accelerator/Coffeefy/1stincoffee_images/lavazza-oro.jpg| ,<br /><br />Lavazza Qualita Oro is an 100% Arabica coffee blend of Central American and African coffee beans. Noted for its full body flavor&#44; it also offers hint of floral flavors as well. <br />,wh2-boston,1000,
COFFEE,coffee,https://caas-demo-products.s3.amazonaws.com/b2c-accelerator/Coffeefy/1stincoffee+category+images/coffee.png,ORGANIC,organic,https://caas-demo-products.s3.amazonaws.com/b2c-accelerator/Coffeefy/1stincoffee+category+images/organic.png,REGULAR,prod_id_1st1,,sku_1st1,Marlboro Hills Espresso 12 oz Whole Bean,Our Signature espresso blend was developed by 1st in Coffee in conjunction with Master Coffee Roaster George Schneider. The blend is comprised of the finest Organic Central and South American Arabica beans&#44; combined with just the right amount of premium Coorg India Cherry Robusta. Our espresso blend coffee beans are roasted in small batches several times per week&#44; as a result you will enjoy the freshest tasting espresso available.,9.99,7.99,$0.00-$9.99,1st in Coffee,,,,https://caas-demo-products.s3.amazonaws.com/b2c-accelerator/Coffeefy/1stincoffee_images/espresso-beans_2.jpg|https://caas-demo-products.s3.amazonaws.com/b2c-accelerator/Coffeefy/1stincoffee_images/marlboro-espresso_2.jpg|https://caas-demo-products.s3.amazonaws.com/b2c-accelerator/Coffeefy/1stincoffee_images/marlboro-hills-espresso.jpg|https://caas-demo-products.s3.amazonaws.com/b2c-accelerator/Coffeefy/1stincoffee_images/espresso-profile.jpg|https://caas-demo-products.s3.amazonaws.com/b2c-accelerator/Coffeefy/1stincoffee_images/espresso-beans.jpg,<br /><br />Marlboro Hills Espresso<br />Fresh Roasted<br />Whole Bean<br />Coffee packaged in resealable valve bags<br />Sold in 12 ounce bags&#44; or choose a 5 pound bag and save.<br />,wh2-boston,1000,
COFFEE,coffee,https://caas-demo-products.s3.amazonaws.com/b2c-accelerator/Coffeefy/1stincoffee+category+images/coffee.png,ORGANIC,organic,https://caas-demo-products.s3.amazonaws.com/b2c-accelerator/Coffeefy/1stincoffee+category+images/organic.png,REGULAR,prod_id_1stpc,,sku_1stpc,Organic Peruvian Chanchamayo 12 oz Whole Bean,Peruvian Chanchamayo coffee is a USDA organically certified coffee from the western slopes of the Andes in Peru. This organic Peruvian coffee is shade grown at high altitudes around of 5600 feet in the valley around the Chanchamayu river. The taste is characterized by bright acidity and has a well-balanced&#44; medium body. Smooth and delicate&#44; it has a slightly nutty flavour in conjunction with the classic South American brightness.,9.99,8.99,$0.00-$9.99,1st in Coffee,,,,https://caas-demo-products.s3.amazonaws.com/b2c-accelerator/Coffeefy/1stincoffee_images/organic-peru_1.jpg|https://caas-demo-products.s3.amazonaws.com/b2c-accelerator/Coffeefy/1stincoffee_images/coffee-label-peru.jpg|https://caas-demo-products.s3.amazonaws.com/b2c-accelerator/Coffeefy/1stincoffee_images/organic-peru.jpg|https://caas-demo-products.s3.amazonaws.com/b2c-accelerator/Coffeefy/1stincoffee_images/peru.jpg|https://caas-demo-products.s3.amazonaws.com/b2c-accelerator/Coffeefy/1stincoffee_images/peru-beans.jpg,<br /><br />Organic Peruvian Chanchamayo Coffee <br />100% High Altitude Andean shade grown Arabica<br />Fresh Roasted Weekly<br />Full City Roast<br />USDA certified Whole Bean coffee<br />Coffee packaged in resealable valve bags<br />This organic Peruvian coffee is sold in 12 ounce bags&#44; or choose a 5-pound bag and save.<br />,wh2-boston,1000,
COFFEE,coffee,https://caas-demo-products.s3.amazonaws.com/b2c-accelerator/Coffeefy/1stincoffee+category+images/coffee.png,ORGANIC,organic,https://caas-demo-products.s3.amazonaws.com/b2c-accelerator/Coffeefy/1stincoffee+category+images/organic.png,REGULAR,prod_id_1strfto,,sku_1strfto,Rwanda Organic Free Trade 12 oz Whole Bean,The climate and volcanic soil of the Lake Kivu region of Rwanda give rise to deep cheery fruit tones in this wonderful coffee. Sourced from the Fair Trade certified COOPAC cooperative. COOPAC is committed to environmental and social sustainability in addition to producing high quality coffee. In the cup&#44; expect something a little sweet and heavy with lemon and grapefruit.,11.99,10.99,$10.00-$24.99,1st in Coffee,,,,https://caas-demo-products.s3.amazonaws.com/b2c-accelerator/Coffeefy/1stincoffee_images/rwanda.jpg|https://caas-demo-products.s3.amazonaws.com/b2c-accelerator/Coffeefy/1stincoffee_images/1st-coffee-costa-rica-label_3_1_1.jpg|https://caas-demo-products.s3.amazonaws.com/b2c-accelerator/Coffeefy/1stincoffee_images/rwanda-organic-3.jpg|https://caas-demo-products.s3.amazonaws.com/b2c-accelerator/Coffeefy/1stincoffee_images/rwanda-macro-adj.jpg|https://caas-demo-products.s3.amazonaws.com/b2c-accelerator/Coffeefy/1stincoffee_images/rwanda-close.jpg,<br /><br />COOPAC is a Fair Trade certified cooperative that began with 110 farmers in 2001&#44; and today has over 2&#44;200 members. COOPAC is committed to environmental and social sustainability in addition to producing high quality coffee. Waste by-products created during the coffee washing process are used to as fertilizer rather than discarded into the lake&#44; and shade trees are distributed to farmers to prevent soil erosion. COOPAC has assisted in the construction of a school&#44; health-care clinics&#44; and roads and bridges in the community&#44; and has a program to distribute cows and goats to the most productive farmers. COOPAC also provides farmers with an agricultural advisor to educate the growers about the latest production methods.<br />This coffee is from the Lake Kivu - Nyamyumba region of Rwanda <br />100% mountain grown Arabica&#44; 1800 meters above sea level<br />Organic and Free Trade certified Rwandan coffee beans<br />Fresh Roasted Weekly<br />Whole Bean<br />Light Roast<br />Coffee packaged in resealable valve bags <br />Rwandan coffee beans sold in 12 ounce bags&#44; or choose a 5 pound bag and save.<br />,wh2-boston,1000,
COFFEE,coffee,https://caas-demo-products.s3.amazonaws.com/b2c-accelerator/Coffeefy/1stincoffee+category+images/coffee.png,ORGANIC,organic,https://caas-demo-products.s3.amazonaws.com/b2c-accelerator/Coffeefy/1stincoffee+category+images/organic.png,REGULAR,prod_id_1stptb,,sku_1stptb,Probably the Best Coffee 12 oz Whole Bean,We asked our head roaster to come up with a great house blend coffee&#44; the result is Probably the Best Coffee. 100% Organic Shade Grown Arabica&#44; Fresh roasted weekly.,12.99,9.99,$0.00-$9.99,1st in Coffee,,,,https://caas-demo-products.s3.amazonaws.com/b2c-accelerator/Coffeefy/1stincoffee_images/probably-the-best.jpg|https://caas-demo-products.s3.amazonaws.com/b2c-accelerator/Coffeefy/1stincoffee_images/probably-the-best-coffee.jpg|https://caas-demo-products.s3.amazonaws.com/b2c-accelerator/Coffeefy/1stincoffee_images/probably.jpg| ,<br /><br />100% Organic mountain and shade grown Arabica coffee beans<br />Fresh Roasted Weekly<br />Whole Bean<br />City Medium-Dark Roast<br />Coffee packaged in resealable valve bags<br />Sold in 12 ounce bags&#44; or choose a 5 pound bag and save.<br /><br />,wh2-boston,1000,
COFFEE,coffee,https://caas-demo-products.s3.amazonaws.com/b2c-accelerator/Coffeefy/1stincoffee+category+images/coffee.png,PODS & CAPSULES,podscapsules,https://caas-demo-products.s3.amazonaws.com/b2c-accelerator/Coffeefy/1stincoffee+category+images/coffee-pods.png,REGULAR,prod_id_vt5184b,,sku_vt5184b,Caffe Vergnano 150 Espresso Pods,These Caffe Vergnano espresso pods are for use in all ESE pod compatible espresso machines.,89.99,89.99,$50.00-$99.99,1st in Coffee,,,,https://caas-demo-products.s3.amazonaws.com/b2c-accelerator/Coffeefy/1stincoffee_images/vergnano-pod.jpg|https://caas-demo-products.s3.amazonaws.com/b2c-accelerator/Coffeefy/1stincoffee_images/pods-espresso-vergnano.jpg|https://caas-demo-products.s3.amazonaws.com/b2c-accelerator/Coffeefy/1stincoffee_images/vergnano-pod_1.jpg| ,<br /><br />For use in all ESE pod compatible espresso machines.<br />Top quality espresso from an espresso pod. . Box of 150 45 mm pods.<br />Each E.S.E. pod contains seven grams of coffee compressed into filter pod with a 45 mm diameter.<br />,wh2-boston,1000,
COFFEE,coffee,https://caas-demo-products.s3.amazonaws.com/b2c-accelerator/Coffeefy/1stincoffee+category+images/coffee.png,PODS & CAPSULES,podscapsules,https://caas-demo-products.s3.amazonaws.com/b2c-accelerator/Coffeefy/1stincoffee+category+images/coffee-pods.png,REGULAR,prod_id_7999,,sku_7999,Illy Dark Roast Espresso Pods Box of 18,Dark intenso roast illy espresso pods are more robust and intense compared to their medium roast.<br />Illy espresso pods are designed for ESE compatible pod espresso machines.<br />Single Serve Medium Roast Espresso Pods - Box of 18 dark roast coffee pods&#44; (each pod is individually wrapped),12.99,12.99,$10.00-$24.99,Illy,,,,https://caas-demo-products.s3.amazonaws.com/b2c-accelerator/Coffeefy/1stincoffee_images/illy-dark-pods2.jpg|https://caas-demo-products.s3.amazonaws.com/b2c-accelerator/Coffeefy/1stincoffee_images/illy-dark-pods.jpg|https://caas-demo-products.s3.amazonaws.com/b2c-accelerator/Coffeefy/1stincoffee_images/dark-roast-ese-espresso-pods.jpg| ,<br /><br />The dark roast illy espresso pods are more robust and intense compared to the medium roast.<br />,wh2-boston,1000,
COFFEE,coffee,https://caas-demo-products.s3.amazonaws.com/b2c-accelerator/Coffeefy/1stincoffee+category+images/coffee.png,PODS & CAPSULES,podscapsules,https://caas-demo-products.s3.amazonaws.com/b2c-accelerator/Coffeefy/1stincoffee+category+images/coffee-pods.png,REGULAR,prod_id_6782,,sku_6782,Illy Decaf Espresso Pods Box of 18,All the great illy espresso taste without the caffeine. illy espresso pods (decaf) are designed for ESE compatible pod espresso machines. Each Box of 18 illy ese espresso pods now contain pods that are individually wrapped. ESE capsules stay fresh for up to two years.,13.99,13.99,$10.00-$24.99,Illy,,,,https://caas-demo-products.s3.amazonaws.com/b2c-accelerator/Coffeefy/1stincoffee_images/decaf-illy-pods.jpg| ,<br /><br />All the great illy espresso taste without the caffeine.<br />,wh2-boston,1000,
