CATEGORY_1_NAME,CATEGORY_1_ID,CATEGORY_1_IMAGES,CATEGORY_2_NAME,CATEGORY_2_ID,CATEGORY_2_IMAGES,PRODUCT_TYPE,PRODUCT_ID,PARENT_ID,SKU,PRODUCT_NAME,PRODUCT_DESCRIPTION,ORIGINAL_PRICE,SELLING_PRICE,PRICE_RANGE,BRAND,VARIANT_COLOR,VARIANT_SIZE,VARIANT_PREPARATION,FULL_SIZE_IMAGES,PRODUCT_DETAILS,LOCATION_ID,ONHAND,TEMP_PRODIDS
COFFEE MAKERS,coffeemakers,https://caas-demo-products.s3.amazonaws.com/b2c-accelerator/Coffeefy/1stincoffee+category+images/coffee-makers.png,GRIND AND BREW,grindandbrew,https://caas-demo-products.s3.amazonaws.com/b2c-accelerator/Coffeefy/1stincoffee+category+thumb+images/grind+and+brew+thumb.png,REGULAR,prod_id_48705,,sku_48705,Capresso CoffeeTEAM PRO Plus Glass,No other coffee maker includes all of the great features found in the stainless steel Capresso Coffee TEAM PRO Plus Glass. This Capresso coffee maker with grinder features a 12 cup glass serving carafe and warming tray with 2 hour safety shut-off. The built-in conical burr grinder automatically self cleans after each cycle.,229,229,$100.00-$249.99,Capresso,,,,https://caas-demo-products.s3.amazonaws.com/b2c-accelerator/Coffeefy/1stincoffee_images/capresso-coffee-team-pro.jpg|https://caas-demo-products.s3.amazonaws.com/b2c-accelerator/Coffeefy/1stincoffee_images/display.jpg|https://caas-demo-products.s3.amazonaws.com/b2c-accelerator/Coffeefy/1stincoffee_images/top_placement.jpg|https://caas-demo-products.s3.amazonaws.com/b2c-accelerator/Coffeefy/1stincoffee_images/ctp_477_glass_ho_50.jpg| ,"<br /><br />Grinding beans fresh before brewing with the Capresso Coffee Team Pro Plus ensures the best possible flavor and aroma in your brewed coffee.<br />Features:<br />Built-in Conical Burr Grinder<br />Solid Steel conical burrs grind slowly to minimize heat build up and preserve flavor and aroma<br />Three settings from fine to coarse<br />Upper burr is easily removed for cleaning<br />Sloped stainless steel path from grind chamber to filter basket prevents clogging<br />Quantity of coffee ground is determined by the number of cups being brewed - Automatically!<br />Special setting for dark roasted oily beans - increases the grinding time to insure consistent results<br />Automatic cleaning of grinder after each pot of coffee<br />Digital LCD Display<br />LCD display provides easy to read display with intuitive control over brewing options<br />Programmable clock timer allows you to wake up to fresh ground and brewed coffee<br />Brew button for manual starting of the grinding and brewing<br />Ability to brew using pre-ground coffee<br />Cup selector automatically controls the amount of coffee ground based on # of cups<br />Oily coffee setting - increases the grinding time for oily slow moving beans<br />Removable Coffee Bean Container<br />Beans stay in the container when bean hopper is removed to clean or change beans <br />7 oz. capacity bean hopper<br />Tight sealing lid preserves coffee freshness<br />Additional Features:<br />Removable 60 ounce water tank<br />Permanent GoldTone filter<br />Stainless steel exterior<br />Charcoal water filtration<br />Drip stop allows you to serve a cup during brewing<br />2 hour safety shut off<br />Coated Non-stick warming plate<br />1000 watt heating element<br />Dimensions: 16 1/2"" High x 8 1/4"" Wide x 12 1/2"" Deep<br /><br />",wh2-boston,1000,
COFFEE MAKERS,coffeemakers,https://caas-demo-products.s3.amazonaws.com/b2c-accelerator/Coffeefy/1stincoffee+category+images/coffee-makers.png,GRIND AND BREW,grindandbrew,https://caas-demo-products.s3.amazonaws.com/b2c-accelerator/Coffeefy/1stincoffee+category+thumb+images/grind+and+brew+thumb.png,REGULAR,prod_id_465,,sku_465,Capresso Coffee Team TS,The Capresso CoffeeTeam TS is a programmable 10 cup coffee maker. It features a stainless steel thermal serving carafe and a built in conical burr grinder.,229,199,$100.00-$249.99,Capresso,,,,https://caas-demo-products.s3.amazonaws.com/b2c-accelerator/Coffeefy/1stincoffee_images/ct_ts_silo_72dpi.jpg|https://caas-demo-products.s3.amazonaws.com/b2c-accelerator/Coffeefy/1stincoffee_images/team-ts-lifestyle.jpg| ,<br /><br />Key Features:<br />Capresso Coffee Team TS - Programmable coffee maker with coffee grinder. Exclusive direct feed technology. Just pour in the coffee beans&#44; program the machine and Capresso Coffee Team TS with thermal carafe does the rest... automatically grinding and brewing the most delicious coffee at any time you want.<br /><br />Conical Burr Grinder<br />The CoffeeTEAM TS uses the same solid steel conical burrs as found in high-end automatic coffee centers. The slow grinding of the burrs imparts minimal heat&#44; preserving more aroma than blade grinding for a finer&#44; more uniform grind. <br /><br /><br /><br /><br />Programmable<br />24-hour programmable clock/timer with easy-to-read LCD display shows time&#44; grind and strength settings<br /><br />GoldTone Filter<br />Permanent GoldTone Filter is easy to use and clean and eliminates the need for paper filters<br /><br /><br /><br /><br />10 Cup Thermal Carafe<br />50 oz. stainless steel thermal carafe keeps your brew hot and fresh for hours.<br /><br />,wh2-boston,1000,
COFFEE MAKERS,coffeemakers,https://caas-demo-products.s3.amazonaws.com/b2c-accelerator/Coffeefy/1stincoffee+category+images/coffee-makers.png,GRIND AND BREW,grindandbrew,https://caas-demo-products.s3.amazonaws.com/b2c-accelerator/Coffeefy/1stincoffee+category+thumb+images/grind+and+brew+thumb.png,REGULAR,prod_id_48805,,sku_48805,Capresso CoffeeTEAM PRO Plus Therm,No other coffee maker includes all of the great features found in the stainless steel Capresso CoffeeTEAM PRO Plus Therm. This version features a 10 cup thermal carafe that keeps coffee hot for hours. The built-in conical burr grinder automatically self cleans after each cycle.,259,259,$250.00-$499.99,Capresso,,,,https://caas-demo-products.s3.amazonaws.com/b2c-accelerator/Coffeefy/1stincoffee_images/team-proplus-therm.jpg|https://caas-demo-products.s3.amazonaws.com/b2c-accelerator/Coffeefy/1stincoffee_images/display_1.jpg|https://caas-demo-products.s3.amazonaws.com/b2c-accelerator/Coffeefy/1stincoffee_images/top_placement_1.jpg| ,"<br /><br />Grinding beans fresh before brewing ensures the best possible flavor and aroma in your brewed coffee. Storing your brewed coffee in a thermal serving carafe maintains the best flavor while keeping your coffee hot.<br />Features of the Capresso Coffee Team Pro Plus with Thermal Carafe:<br />Built-in Conical Burr Grinder<br />Solid Steel conical burrs grind slowly to minimize heat build up and preserve flavor and aroma<br />Three setting from fine to coarse<br />Upper burr is easily removed for cleaning<br />Sloped stainless steel path from grind chamber to filter basket prevents clogging<br />Quantity of coffee ground is determined by the number of cups being brewed - Automatically!<br />Special setting for dark roasted oily beans - increases the the grinding time to insure consistent results<br />Automatic cleaning of grinder after each pot of coffee<br />Digital LCD Display<br />LCD display provides easy to read display with intuitive control over brewing options<br />Programmable clock timer allows you to wake up to fresh ground and brewed coffee<br />Brew button for manual starting of the grinding and brewing<br />Ability to brew using pre-ground coffee<br />Cup selector automatically controls the amount of coffee ground based on # of cups<br />Oily coffee setting - increases the grinding time for oily slow moving beans<br />Removable Coffee Bean Container<br />Beans stay in the container when bean hopper is removed to clean or change beans <br />7 oz. capacity bean hopper<br />Tight sealing lid preserves coffee freshness<br />Additional Features:<br />Removable 50 ounce water tank<br />Permanent GoldTone filter<br />Stainless steel exterior<br />Charcoal water filtration<br />Drip stop allows you to serve a cup during brewing<br />1000 watt heating element<br />Dimensions: 16 1/2"" High x 8 1/4"" Wide x 12 1/2"" Deep<br /><br />",wh2-boston,1000,
COFFEE MAKERS,coffeemakers,https://caas-demo-products.s3.amazonaws.com/b2c-accelerator/Coffeefy/1stincoffee+category+images/coffee-makers.png,SINGLE SERVE,singleserve,https://caas-demo-products.s3.amazonaws.com/b2c-accelerator/Coffeefy/1stincoffee+category+thumb+images/semi-automatic+thumb.png,REGULAR,prod_id_42505,,sku_42505,Capresso On the Go,The Capresso On-The-Go personal coffee maker is the ideal choice to brew ground coffee or coffee pods. It serves the perfectly brewed coffee in less than 4 minutes! The compact size&#44; solid construction&#44; and a Stainless Steel Thermal Travel Mug ensure no hassles with the On-The-Go coffee maker!,49.99,39.99,$25.00-$49.99,Capresso,,,,https://caas-demo-products.s3.amazonaws.com/b2c-accelerator/Coffeefy/1stincoffee_images/otg_lifestyle.jpg|https://caas-demo-products.s3.amazonaws.com/b2c-accelerator/Coffeefy/1stincoffee_images/mug_in_car.jpg|https://caas-demo-products.s3.amazonaws.com/b2c-accelerator/Coffeefy/1stincoffee_images/coffee_filter.jpg| ,<br /><br />Description:<br />Now&#44; you can brew ground coffee or those precious&#44; hand-picked coffee pods in less than 4 minutes! The Capresso On-The-Go Personal Coffee Maker brews your coffee directly into a 16-oz Stainless Steel Thermal Travel Mug. The stainless steel body uplifts the aesthetics too&#44; lending the machine a very upmarket appearance. The Personal Coffee Maker brews coffee at the ideal temperature of 200 degrees Fahrenheit. The result is a perfectly brewed cup of coffee that uplifts your spirits in the first sip!<br />The Capresso On-The-Go Coffee Maker uses the latest technology in coffee-making&#44; ensuring you get the authentic brew. The list of features includes:<br />Compact Design: helps to save space&#44; making it perfect for smaller kitchen counters or when packing your coffee maker for a vacation.<br />16-oz Stainless Steel Mug: this On-The-Go coffee maker brews directly in the thermal travel mug. This saves the usual hassle of pouring the scorching coffee in another container. The Travel Mug is designed to fit in most car cup-holders and can easily accommodate up to 7-inch mugs.<br />Removable Permanent Filter: it is easier to clean and also eliminates the need for paper filter.<br />Large Shower Head: it is perfect for maintaining accuracy in saturation and extraction.<br />Brew with ground coffee or soft coffee pods<br />Temperature Setting of 200 degrees Fahrenheit: the best temperature for extracting the authentic taste of coffee.<br />On/Off Switch: ensures ease-of-use and helps to save energy when the Personal Coffee Maker is not in use.<br />This Capresso On-The-Go personal coffee maker automatically shuts-off once the coffee is ready to be served. The overall package is irresistible—you get the assurance of durability&#44; a prefect brew&#44; on-the-go dexterity&#44; space-saving attributes&#44; and the latest in coffee-making technology.<br />,wh2-boston,1000,
COFFEE MAKERS,coffeemakers,https://caas-demo-products.s3.amazonaws.com/b2c-accelerator/Coffeefy/1stincoffee+category+images/coffee-makers.png,SINGLE SERVE,singleserve,https://caas-demo-products.s3.amazonaws.com/b2c-accelerator/Coffeefy/1stincoffee+category+thumb+images/semi-automatic+thumb.png,REGULAR,prod_id_42605,,sku_42605,Capresso 5 Cup Mini Drip Coffee Maker,The Capresso 5 cup coffee maker brews coffee better than other coffee machines due to the quick preparation time (less than a minute per cup) which ensures your coffee is never over extracted or bitter. The Capresso 5 Cup Mini Drip Coffee Maker has a beautiful black design with stainless steel accents and an LCD display with programmable timer. The automatic 2-hour shut-off feature means you never have to worry about forgetting to turn off the Capresso 5 cup coffee maker. The glass serving carafe with drip free pouring produces 25 oz. of coffee at a time with a GoldTone filter&#44; so there is no need to use paper filters ever again. The drip stop feature allows a cup to be poured during brewing&#44; so you don’t have to wait for a delicious cup of coffee.,39.99,39.99,$25.00-$49.99,Capresso,,,,https://caas-demo-products.s3.amazonaws.com/b2c-accelerator/Coffeefy/1stincoffee_images/minidrip-silo-50.jpg|https://caas-demo-products.s3.amazonaws.com/b2c-accelerator/Coffeefy/1stincoffee_images/minidrip-controls.jpg|https://caas-demo-products.s3.amazonaws.com/b2c-accelerator/Coffeefy/1stincoffee_images/426-open-lid.jpg| ,"<br /><br />Features of the Capresso 5-Cup Coffee Maker:<br />5 Cup (25 oz.) glass serving carafe with drip free pouring.<br />GoldTone filter eliminates the need for paper filters<br />LCD display with 24 hour programmable clock / timer<br />Water tank features internal 1 -5 cup levels<br />Drip stop allows a cup to be poured during brewing<br />Non-stick carafe warming plate<br />2 hour auto shut-off<br />Black with stainless steel accents<br />650 Watt heating element<br />Dimensions: 10"" H x 6 1/4"" W x 8"" Deep<br />1 Year Mfg. Warranty<br /><br />",wh2-boston,1000,
COFFEE MAKERS,coffeemakers,https://caas-demo-products.s3.amazonaws.com/b2c-accelerator/Coffeefy/1stincoffee+category+images/coffee-makers.png,SINGLE SERVE,singleserve,https://caas-demo-products.s3.amazonaws.com/b2c-accelerator/Coffeefy/1stincoffee+category+thumb+images/semi-automatic+thumb.png,REGULAR,prod_id_60208,,sku_60208,Francis Francis Y5 Espresso Coffee,New from Francis Francis for Illy&#44; the Y5 Espresso & Coffee prepares both real Italian espresso and regular coffee. Utilizing Illy's Iper espresso and coffee capsules&#44; you can make both in seconds at the touch of a button. The illy Francis Francis Y5 Espresso & Coffee is sleek: it features a tempered glass top and sturdy aluminum body.,299,249,$100.00-$249.99,Francis Francis,,,,https://caas-demo-products.s3.amazonaws.com/b2c-accelerator/Coffeefy/1stincoffee_images/y5-black_1.jpg| ,"<br /><br />Y5 Espresso & Coffee Machine You can have it all! Delicious full bodied espresso or a wonderful mug of great coffee.<br />The illy Francis Francis Y5 Espresso & Coffee works exclusively with illy Iper espresso and coffee capsules.<br />Specifications of the Illy Y5 Espresso & Coffee:<br />30 oz. water tank<br />2 Brew buttons - one for coffee&#44; one for espresso<br />Used Capsule bin holds 10 spent capsules<br />Adjustable cup platform<br />All metal body with tempered glass top<br />Dimensions: 5.7"" Wide&#44; 11.2"" Deep and 9.6"" High<br />",wh2-boston,1000,
ESPRESSO MACHINES,espressomachines,https://caas-demo-products.s3.amazonaws.com/b2c-accelerator/Coffeefy/1stincoffee+category+images/espresso_machines.png,COMMERCIAL,commercial,https://caas-demo-products.s3.amazonaws.com/b2c-accelerator/Coffeefy/1stincoffee+category+thumb+images/Commercial-Espresso-Machines+thumb.png,REGULAR,prod_id_pub1v,,sku_pub1v,La Pavoni Pub 1V Commercial Espresso Machine,Made with the finest materials in Milan Italy&#44; La Pavoni Pub 1V Commercial Espresso Machine is an investment in your future. Producing the highest quality coffee combined with the latest technology for efficiency and convenience&#44; this La Pavoni espresso machine meets all your needs. With a direct connection to your water line&#44; the need to fill the La Pavoni espresso machine's water tank by hand is eliminated. The La Pavoni Pub 1V is group made with press-forged brass and chrome plated with vertical infusion chamber and pressurization system which eliminates group dripping. Pre-infusion of the coffee grounds produces consistent&#44; balanced shots of coffee. La Pavoni Pub 1V features one steam wand with digital control pad and microprocessor&#44; and a knob which controls the hot water jet. The La Pavoni Pub1V also offers 4 cup size selections including continuous brewing and an instant-stop button. Choose your preference in design: red or black side panels.,4350,4350,$2500.00-$4999.99,La Pavoni,,,,https://caas-demo-products.s3.amazonaws.com/b2c-accelerator/Coffeefy/1stincoffee_images/pub-1v-red.jpg| ,"<br /><br />The Pub 1V La Pavoni espresso machine is equipped with the latest technology such as thermal stability to the coffee group which ensure a constant temperature and pre-infusion of the coffee grounds which allows for consistent&#44; balanced shots of coffee.An espresso machine is your companies most important purchase&#44; a quality built one such as a La Pavoni espresso machine features brand name components such as Parker solenoids&#44; Sirai pressurestat and Procon motors with NSF marking.Electronic programmable dosing espresso machine with digital control pad and microprocessor. Four cup size selections including continuous brewing and an instant -stop button. Hot water jet is controlled by Knob. Press- forged nickel brass groups with vertical infusion chamber and pressurization system. One steam wand.<br />Specifications:<br />Group made with press-forged brass and chrome plated&#44; with vertical infusion chamber and pressurization system which eliminates group dripping.<br />Copper boiler equipped with front mounted transversal heat exchanger and injector<br />Thermal stability: Independent radiator hydraulic system for consistent water circulation throughout the boiler.<br />Anti-vacuum valve eliminates liquids from back flushing into the steam wand.<br />Mounted gauge to monitor boiler pressure.<br />One double portafilter&#44;and 2 coffee baskets.<br />Spring taps for hot water and steam<br />Steam wand<br />Hot water dispenser<br />Internal electric pump<br />6.5 Liter boiler<br />Fittings and hoses for connection to your water line included<br />1500 watts&#44; 110 volts&#44; 13 amps<br />Dimensions: 21"" High&#44; 15"" Wide&#44; 21"" Deep -- Weight 90 pounds<br />Recommended for up to 200 drinks per day<br />8 Liter water softener included<br />Made in Milan Italy<br />Your choice: Red or Black side panels<br />The PUB 1V La Pavoni espresso machine requires direct water plumbing.<br />12 month parts warranty included Service and Installation services are available through a nationwide network&#44; call for details<br />Actual freight charges will be billed upon delivery<br />",wh2-boston,1000,
ESPRESSO MACHINES,espressomachines,https://caas-demo-products.s3.amazonaws.com/b2c-accelerator/Coffeefy/1stincoffee+category+images/espresso_machines.png,COMMERCIAL,commercial,https://caas-demo-products.s3.amazonaws.com/b2c-accelerator/Coffeefy/1stincoffee+category+thumb+images/Commercial-Espresso-Machines+thumb.png,REGULAR,prod_id_pub2v,,sku_pub2v,La Pavoni Pub 2V,For productivity and performance&#44; La Pavoni Pub 2V is way ahead of the competition. Made to meet the highest standards&#44; this La Pavoni espresso maker produces enough volume to meet your needs with 2 Coffee Groups to double productivity. Pre-infusion of the coffee grounds leads to consistency and balance in each shot of coffee. Due to thermal stability technology&#44; each coffee group performs at a reliable and constant temperature. The direct connection to your water line makes it unnecessary to fill the La Pavoni Espresso maker's water tank by hand. It's an electronic programmable dosing La Pavoni espresso maker with digital control pad and microprocessor that brews continuously for four cup size selections with an instant-stop button. Two double portafilters with 2 coffee baskets each makes up to 400 drinks daily. Mounted gauge to monitor boiler pressure&#44; vertical infusion chamber and pressurization system which eliminates group dripping. The La Pavoni Pub 2V delivers the excellence expected from this famous Italian brand. Made in Milan Italy. Side panels available in red or black.,4950,4950,$2500.00-$4999.99,La Pavoni,,,,https://caas-demo-products.s3.amazonaws.com/b2c-accelerator/Coffeefy/1stincoffee_images/pub-2v-b.jpg|https://caas-demo-products.s3.amazonaws.com/b2c-accelerator/Coffeefy/1stincoffee_images/pub-2v-r.jpg| ,"<br /><br />Equipped with the latest technology such as thermal stability to the coffee groups which ensure a constant temperature and pre-infusion of the coffee grounds which allows for consistent&#44; balanced shots of coffee.  An espresso machine is your companies most important purchase&#44; a quality built machine such as the La Pavoni Pub 2V features brand name components such as Parker solenoids&#44; Sirai pressurestat and Procon motors with NSF marking. This is an electronic programmable dosing La Pavoni espresso maker with digital control pad and microprocessor. Four cup size selections including continuous brewing and an instant -stop button. Hot water jet is controlled by Knob. Press- forged nickel brass groups with vertical infusion chamber and pressurization system. One steam wand.<br />Specifications of La Pavoni Pub 2V:<br />2 Groups made with press-forged brass and chrome plated&#44; with vertical infusion chamber and pressurization system which eliminates group dripping<br />Copper boiler equipped with front mounted transversal heat exchangers and injectors for each group<br />Thermal stability: La Pavoni espresso maker with an independent radiator hydraulic system for every group that allows for consistent water circulation throughout the boiler.<br />Anti-vacuum valve eliminates liquids from back flushing into the steam wand.<br />Mounted gauge to monitor boiler pressure.<br />Two double portafilters with 2 coffee baskets each.<br />Spring taps for hot water and steam<br />Steam wand<br />Hot water dispenser<br />Internal electric pump<br />6.5 Liter boiler<br />Fittings and hoses for connection to your water line included<br />1500 watts&#44; 110 volts&#44; 13 amps<br />Dimensions: 21"" High&#44; 20"" Wide&#44; 21"" Deep -- Weight 98 pounds<br />Recommended for up to 400 drinks per day<br />8 Liter water softner included<br />Made in Milan Italy<br />Your choice: Red or Black side panels<br />PUB2V requires direct water plumbing.<br />12 month parts warranty included with La Pavoni Pub 2VService and Installation services are available through a nationwide network&#44; call for details Actual freight charges will be billed upon delivery<br />",wh2-boston,1000,
ESPRESSO MACHINES,espressomachines,https://caas-demo-products.s3.amazonaws.com/b2c-accelerator/Coffeefy/1stincoffee+category+images/espresso_machines.png,COMMERCIAL,commercial,https://caas-demo-products.s3.amazonaws.com/b2c-accelerator/Coffeefy/1stincoffee+category+thumb+images/Commercial-Espresso-Machines+thumb.png,REGULAR,prod_id_bart2v,,sku_bart2v,La Pavoni Bar T 2 Group Commercial Espresso Machine,La Pavoni BAR espresso machines are equipped with the latest technology and highest quality components. Direct connection to your water line on the La Pavoni Bar-T eliminates filling the water tank by hand. 2 Steam wands. This La Pavoni commercial espresso machine operates on 220 volt current for volumes up to 600 drinks per day.,5950,5950,$5000.00-$9999.99,La Pavoni,,,,https://caas-demo-products.s3.amazonaws.com/b2c-accelerator/Coffeefy/1stincoffee_images/la_pavoni_bar-t_2_group_volumetric_commercial_espresso_machine__55890_zoom.jpg| ,"<br /><br />Equipped with the latest technology such as thermal stability to the coffee groups which ensure a constant temperature and pre-infusion of the coffee grounds which allows for consistent&#44; balanced shots of coffee.  An espresso machine is your companies most important purchase&#44; a quality built machine such as the La Pavoni Bar-T features brand name components such as Parker solenoids&#44; Sirai pressure stat and Procon motors with NSF marking.  Electronic programmable dosing espresso machine with digital control pad and microprocessor. Four cup size selections including continuous brewing and an instant -stop button. Hot water jet is controlled by Knob. Press-forged nickel brass groups with vertical infusion chamber and pressurization system. Two steam wands.<br />Specifications of this La Pavoni commercial espresso machine:<br />2 Groups made with press-forged brass and chrome plated&#44; with vertical infusion chamber and pressurization system which eliminates group dripping<br />Boiler in copper equipped with transversal heat exchangers and front injectors for each group<br />Independent radiator hydraulic system for every group<br />Thermal stability: Independent radiator hydraulic system for every group allows for consistent water circulation throughout the boiler.<br />Anti-vacuum valve eliminates liquids from back flushing into the steam wand.<br />Mounted gauge to monitor boiler pressure.<br />Two double spout portafilters&#44; each with a single and a double coffee baskets<br />One low profile portafilter which allows for brewing into a 7"" high cup<br />Spring taps for hot water and steam<br />2 Steam wands<br />Hot water dispenser<br />Internal electric pump<br />14 Liter boiler<br />Fittings and hoses for connection to your water line included<br />4370 watts&#44; 220 volts<br />Dimensions: 21"" High&#44; 30"" Wide&#44; 21"" Deep -- Weight 129 pounds<br />Recommended for up to 600 drinks per day<br />8 Liter water softner included<br />Made in Milan Italy<br />Your choice: Red or Black side panels<br />BAR2V requires direct water plumbing.<br />12 month parts warranty included with the La Pavoni commercial espresso machine Service and Installation services are available through a nationwide network&#44; call for details. Actual freight charges will be billed upon delivery<br />",wh2-boston,1000,
